{
  "schema_version": "agent_forecast_report_v3",
  "report_mode": "forecast",
  "truth_accessed": false,
  "case_id": "20200501_00_048",
  "region_id": "SA-09",
  "hazard": "heavy_rain",
  "risk_level": "low",
  "risk_score": 0.0,
  "confidence": "medium",
  "rule_id": "heavy_rain_graphcast_scale_v2",
  "rule_status": "frozen",
  "knowledge_prior_status": "context_only",
  "knowledge_prior_risk": null,
  "conflict_flag": "possible_underestimation",
  "attention_level": "routine",
  "shadow_correction_status": "triggered_not_activated",
  "shadow_suggested_risk_level": "medium",
  "shadow_may_overwrite_base_risk": false,
  "generation_mode": "deterministic",
  "status_disclosure_zh": "无真值预测模式；本报告未读取同期观测、灾害影响、新闻真值或事后验证。本案例为使用后期方法参考进行的2020迁移回放，不是实时业务预警。",
  "executive_summary_zh": "Jazan Region在2020-05-02T00:00:00Z至2020-05-03T00:00:00Z的heavy_rain气象风险为low，置信度为medium。触发影子纠错候选，但它尚未取得新的前瞻或独立验证，默认关注级别不变。",
  "weather_evidence_zh": "Risk JSON包含2条支持证据、3条反向证据和0条缺失证据。",
  "knowledge_context_zh": "已取得满足起报时间边界的ADM1静态地形和月降水气候背景，但它不能识别具体事件日，因此不生成知识风险等级。该ADM1高程P10/P90为11.0/1246.0 m，对应月份长期降水区域均值/P90为10.908/19.0 mm。冻结暴雨规则仍为低风险，但区域降水P95已达到中风险阈值的至少50%， 且至少两个水汽或动力条件达到支持阈值。development回顾中该单窗条件 补回1个漏报且未新增误报，但证据只来自1个事件案例，因此仅作为影子纠错候选。",
  "limitations_zh": [
    "Forecast Agent不得读取同期或事后的气象观测、灾害影响、新闻证据和验证结果。",
    "Risk JSON中的verification字段已从预测视图剔除，不得在预测报告中复述。",
    "风险等级、分数、置信度和规则状态必须与Risk JSON一致。",
    "知识先验不可用时必须明确写unknown/not_available，不得用同期真值补齐。",
    "未通过新验证的影子纠错只保留并列建议，不得提高默认关注级别、证明模型错误或改写气象风险。",
    "本项目使用MAZU 2025方法参考回放2020案例，属于迁移回放，不是字面意义上的2020实时业务预报。"
  ],
  "recommended_actions_zh": [
    "保持Risk JSON原始风险等级，不由报告层改写。",
    "影子纠错建议仅供人工复核；在取得新的前瞻或独立证据前，不覆盖冻结Risk JSON。",
    "预测锁定后才能由Verification Agent读取2020真值并判断命中或漏报。"
  ],
  "cited_prior_source_ids": [
    "WORLDCLIM21_ELEV_10M",
    "WORLDCLIM21_PREC_10M"
  ]
}
